{
  "type": "object",
  "properties": {
    "deal_seq": {
      "type": "integer",
      "minimum": 1,
      "description": "Per-deal monotonic event number assigned by BF (persisted with the deal; survives restart). Present on events BF writes to the deal's event journal; a gap seen by AFB means a lost event, healed on the next session.resync (BF replays the journal tail above the `applied_deal_seq` AFB reports). On deal.snapshot it is the last number issued at snapshot time and is not itself consumed. Optional: an older BF omits it, an older AFB ignores it."
    },
    "deal_id": {
      "type": "string"
    },
    "execution_phase": {
      "type": "string"
    },
    "observed": {
      "type": "object"
    },
    "positions": {
      "type": "array",
      "items": {
        "type": "object",
        "properties": {
          "symbol": {
            "type": "string"
          },
          "quantity": {
            "type": "integer"
          },
          "average_price": {
            "type": "string"
          },
          "updated_at": {
            "type": "string"
          }
        },
        "additionalProperties": true
      }
    },
    "quantity": {
      "type": "integer",
      "description": "Resolved order quantity (lots), fixed once by BF at entry-trigger time (`resolved_quantity`). Present only once known — never present before the entry order is placed, never cleared afterward."
    },
    "status": {
      "type": "string"
    }
  },
  "additionalProperties": true,
  "required": [
    "deal_id"
  ],
  "$schema": "https://json-schema.org/draft/2020-12/schema",
  "$id": "https://github.com/Rolo837/AFB-BF-protocol/spec/schemas/payloads/deal.snapshot.json",
  "title": "payload: deal.snapshot"
}
